{
  "$schema": "https://json-schema.org/draft/2020-12/schema",
  "$id": "https://awg.local/contracts/firehose/subscription.schema.json",
  "title": "Firehose Subscription",
  "type": "object",
  "properties": {
    "schema_version": {
      "type": "string"
    },
    "subscription_id": {
      "type": "string"
    },
    "world_ids": {
      "type": "array",
      "items": {
        "type": "string"
      }
    },
    "branch_ids": {
      "type": "array",
      "items": {
        "type": "string"
      }
    },
    "event_type_patterns": {
      "type": "array",
      "minItems": 1,
      "items": {
        "type": "string"
      }
    },
    "actor_ids": {
      "type": "array",
      "items": {
        "type": "string"
      }
    },
    "place_ids": {
      "type": "array",
      "items": {
        "type": "string"
      }
    },
    "cursor": {
      "type": [
        "string",
        "null"
      ]
    },
    "delivery": {
      "enum": [
        "stream",
        "batch",
        "file"
      ]
    },
    "batch_size": {
      "type": "integer",
      "minimum": 1,
      "maximum": 10000
    },
    "backpressure": {
      "enum": [
        "pause",
        "spill_to_disk",
        "disconnect_with_cursor"
      ]
    },
    "redaction_profile": {
      "type": "string"
    }
  },
  "required": [
    "schema_version",
    "subscription_id",
    "event_type_patterns",
    "delivery",
    "batch_size",
    "backpressure",
    "redaction_profile"
  ],
  "additionalProperties": false
}
